发明 涉及 种 金属 异物 检测 自动 平衡 技术 特别是 涉及 种 开机 进行 自动 平衡 调节 金属 异物 检测 自动 平衡 技术 发明 解决 金属 异物 检测 机因 原始 静态 平衡 状态 发生 一定 变化 后 检测 灵敏度 低 稳定性 差 问题 弥补 现有 技术 难以 自动 平衡 广泛 适用性 不足 	检测
实用 新型 名称 煤气罐 安全 自动 控制 装置 属于 燃气 控制 装置 领域 主要 解决 以往 燃气 管道 安全 自控 装置 存在 适用于 燃气 压力 变化 煤气罐 燃气 控制 技术 方案 煤气罐 安全 自动 控制 装置 包括 上腔 下腔 上腔 出气 相连 下腔 进 气管 相连 特征 所述 自动 控制 装置 下腔 加装 减压 装置 具有 适用于 燃气 压力 变化 燃气 管道 控制 特点 适用 种 煤气罐 煤气 管道 控制 	检测
发明 压力 检测 装置 包括 压力 检测 设备 施加 其上 压力 导致 张力 转换 电信号 输出 转换 后 电信号 容纳 基底 包括 所述 压力 检测 设备 容纳 容纳 凹槽 介于 压力 检测 设备 所述 容纳 凹槽 之间 连接 材料 所述 连接 材料 高 百分比 抗 张伸展 率 连接 压力 检测 设备 容纳 凹槽 发明 压力 检测 装置 易于 防止 热 应力 对其 检测 性能 造成 不利 影响 获得 优良 热 响应 检测力 动量 	检测
发明 种 防止 气体 逆流 转接器 方法 转接器 具有 一外管 侧壁 形成 进 气口 内管 套入 外管 侧壁 相对于 外管 进气口 位置 形成 环状 内凹 方法 应用于 具有 外 内管 转接器 包括 以下 步骤 提供 惰性 气体 注入 外管 进气口 氮气 内管 环状 内凹 使该 惰性 气体 均匀 分散 内管 外管 间隙 之间 惰性 气体 转接器 端 形成 气瀑 防止 气体 逆流 预防 气体 	稳定
发明 提供 用于 去除 抖动 稳定 扭转 铰链 装置 反馈 系统 设备 方法 来自 光束 光源 旋转 反射镜 反射 表面 引导 感光 介质 传感器 运动 传感 信号 提供 控制 驱动 机构 监视 控制 电路 振动 装置 施加 所述 设备 驱动 扭矩 中 提供 对称性 实现 稳定性 所述 旋转 运动 外 引入 微小 横向 运动 	稳定
发明 公开 种 管道 流体 实施 计量 控制 防止 阀门 关闭 断流 引发 安全 事故 自动 控制阀 主要 阀体 阀芯 控制 装置 组成 特征 阀上 设有 受控 主 通路 呈 并联 状态 旁路 旁路 通径 小于 受控 主 通道 通径 阀 发生 自动 关闭 主 通路 断流 时 避免 完全 断流 发生 不良 后果 起到 提示 报警 作用 	稳定
种 自动 控制器 锁死 机构 属 机械 领域 解决 自动 控制器 冲击力 下 防止 棱齿 变形 断裂 问题 主 自动 控制器 锯形 齿条 隔 段 距离 孔 孔 供 子 自动 控制器 锯形 齿条 端 插入 用于 自动 控制器 电动 选 位器 机械 	稳定
发明 公开 种 数控 机床 液压 动力 夹具 属于 机械 加工 领域 夹具 包括 油缸 拉杆 过渡 盘 夹 具体 夹 具体 内腔 设有 压盘 压盘 外缘 啮合 压 爪 轴 压爪 轴上 设有 导向槽 结合 导向 螺钉 实现 压爪 轴 做 轴 运动 时 进行 周 摆动 发明 结构 新颖 壳体 类 零件 装 夹 牢固 稳定 性好 很好地 保证 加工 精度 缩短 零件 加工 辅助 时间 提高 工作 效率 对压爪 轴 结构 压头 大小 调整 实现 零件 装夹 夹具 实用性 广 	稳定
发明 涉及 种 回转 工作台 回转 分 度 定位 机构 包括 内楔环 外 楔环 钢球 压板 保持 架 外楔 环 台 体 相对 楔环 转动 内楔环 外 周边 外楔环 内周 边上 分别 设有 相向 对合 凹槽 压板 可将 钢球 压紧 在内 外楔环 凹槽 中 使 外楔 环 相对 定位 保持 架上 设有 法兰套 钢球 置 放于 法兰 套 中 发明 优点 回转 分 度 过程 中 外楔环 相对 楔环 压板 转动 时 保持 架及 法兰 套 带动 钢球 始终 悬于 外楔环 上端 钢球 外楔 环 不相 接触 定位 压紧 时 钢球 回落 外楔环 凹槽 减小 外楔环 磨损 提高 回转 工作台 定位 精度 保持性 回转 时 无 咔嗒咔嗒 钢球 碰 撞声 	稳定
实用 新型 公开 种 水冷 缸 柴油机 平衡 机构 平衡 机构 曲轴 第八 曲柄 臂 设有 大齿圈 平衡 箱 设有 旋转 方向 相反 设有 齿轮 平衡 块 平衡 轴 主要 特点 在于 所述大齿 圈上 设有 补偿 所述 第八 曲柄 臂 减少 平衡 质量 平衡 块 方案 完全 避免 安装 加强 齿圈 不利于 主轴承 平均 负荷 第四 主轴颈 内力矩 影响 有利于 降低 发动机 振动 改进 后 平衡 机构 运用 大缸径 汽车 发动 机上 原来 缸 机 改进 缸 机 保持 原 缸 机 性能 前提 下 可使 产品 结构 紧凑 减小 体积 降低 成本 	稳定
种 电缆 防盗器 包括 壳体 壳体 合页 连接 下 壳体 壳体 下 壳体 闭合 时 呈 管状 壳体 内壁 设置 防盗 夹 所述 防盗 夹 包括 弹性 连杆 设置 弹性 连杆 端 部 锁紧 件 所述 锁紧 件 底部 设有 斜向 咬齿 实用 新型 结构 巧妙 合理 使用 方便 种 广泛 安装 电缆线 护套 管内 起到 防盗 作用 电缆线 防盗器 	稳定
实用 新型 提供 种 矿井 防水 闸门 轨 连接 定位 装置 属于 矿井 设备 结构 钢 托板 道钉 枕木 固定 轨 活轨 连接 梁 构成 钢 托板 道钉 分别 设置 相邻 两 根 枕木 两 端 轨道 方向 成 一定 夹角 固定 轨 端 部分 设置 钢 托板 形成 类似 八边形 框槽式 结构 端 部 轨道 方向 成 一定 夹角 两 根 相互 平行 活轨 连接 梁 构成 梯子形 结构 放置 钢 托板 固定 轨 围成 框 槽内 实用 新型 矿井 防水 闸门 轨 连接 定位 装置 现有 技术 相比 具有 设计 合理 结构 简单 易于 加工 使用 方便 拆卸 容易 特点 具有 好 推广 使用 价值 	稳定
发明 涉及 转动 夹盘 种 夹盘 具有 主体 多个 夹钳 调节 环 所述 调节 环 所述 夹钳 螺纹 接合 所述 调节 环沿 方向 转动 时 所述 夹钳 移动 收紧 所述 调节 环沿 相反 方向 转动 时 所述 夹钳 移动 远离 放松 提供 撞击 元件 便于 所述 调节 环 相 接合 所述 动力 工具 驱动 轴 转动 时 所述 调节 环 撞击 撞击 元件 所述 夹盘 调节 环 主体 相对于 转动 取决于 所述 驱动 轴 转动 方向 夹盘 夹钳 放松 收紧 	稳定
发明 公开 种 蜂窝状 多孔 聚酯 低温 绝热 容器 包括 形状 相同 内胆 外壳 上部 瓶颈 顶盖 内胆 腔 体内 充灌 液氮 液氦 低温 工质 内胆 外壳 之间 中间 真空 夹层 蜂窝状 多孔 聚酯 低温 热层 蜂窝状 多孔 聚酯 低温 热层 耐 以下 温度 低温 胶 多孔 聚酯 颗粒 比例 均匀 混合 调制 而成 发明 蜂窝状 多孔 聚酯 低温 绝热 容器 具有 绝热性 优良 制造 工艺 简单 运输 方便 安全 可靠 使用 寿命 长 无须 抽真空 显著 优点 储存 低温 介质 日 蒸发率 低 制造 成本 远 低于 传统 真空 低温 绝热 容器 	稳定
带有 盘式 电机 电梯 机械 电机 定子 盘 环形腔 腔内 安装 定子 定子 固定 腔 面 壁上 转子 装在 转子 盘 至少 腔 面壁 转子 盘 之间 道 密封 密封 使腔 成为 封 闭 空间 封住 外界 颗粒 进入 转子 定子 入口 	稳定
种 辐射 传输 设备 稳定 微波 能量 源 方法 设备 包括 微波 能量 源 耦合 能量 源 微波 利用 设备 非 相互 传送 设备 源 耦合 利用 设备 传送 设备 接收 来自 所述 设备 能量 未 利用 部分 传送 设备 调整 未 利用 能量 调整 后 能量 返回 源 传送 设备 包括 第一 部件 第一 部件 操作 调节 能量 第一 属性 调节 影响 能量 属性 返回 调整 后 能量 修改 源 频率 作用 系统 中 未 利用 能量 最小化 稳定 源 输出 能量 频率 稳定力 动量 	稳定
发明 达到 拉杆 偏差 移动 利 目的 提供 种 拉杆 稳定器 具体 技术 措施 拉杆 支架 孔径 放大 固定 装配 直线 轴承 直线 轴承 外径 拉杆 支架 孔径 固定 结合 直线 轴承 内径 拉杆 外径 紧密 配合 发明 益处 ① 利用 直线 轴承 控制 拉杆 滑动 有效 保证 拉杆 平行度 性能 十分 理想 ② 每层 主 链条 平行 度 得到 有效 控制 进一步 保证 并列 两 排 十四 层 主 链条 平行度 防止 蜡盘组 卡盘 现象 提高 设备 运行 安全率 ③主 链条 保持 平稳 运行 链轮 始终 保持 吻合 延长 使用 寿命 	稳定
发明 公开 种 避雷 鞋 包括 验电器 外接 电路 所述 验电器 包括 金属 杆 金属 箔片 金属 箔片 两 金属 接触 板 金属 接触 板 接 外接 电路 外接 电路 电池组 报警 装置 金属 杆 两 金属 箔片 处于 密封 盒内 金属 杆 金属 球 处于 密封 盒外 发明 及时 预知 雷电 危险 存在 使 人 能够 避开 危险 造价 低 安全 实用 发明 避雷 鞋 变换 形式 后 装在 随身 物品 	稳定
实用 新型 公开 种 气门 挺杆 组合 方案 包括 凸轮轴 气门 气门 顶柱 气门 调整 垫片 组成 气门 挺杆 装置 中 安装 气门 气门 顶柱 外侧 端 安装 气门 调整 垫片 气门 调整 垫片 凸轮轴 相 接触 气门 调整 垫片 放在 气门 顶柱 外侧 端 调整 气门 间隙 时 须将 气门 挺杆 取下 后 进行 调整 实际 生产 维修 方便 气门 调整 垫片 做 较大 直接 凸轮轴 接触 增加 接触 面积 降低 磨损 延长 气门 调整 垫片 寿命 使 工作 性能 可靠 结构 简单 	稳定
发明 涉及 种 调整 稳定 风能 传递 方法 传递 电力网 存在 风速 波动 摆动 时 避免 突然 波动 摆动 所述 方法 优选 使用 风 车站 包括 许多 直接 使用 站 能量 储存 站 混合站 能量 直接 电力网 使用 需求 高 风 利用 性 低 时 能量 储存 以后 使用 所述 方法 考虑 形成 能量 传递 计划 调整 直接 能量 来自于 储存 能量 使用 调整 天 风速 预报 基础 预报 有助于 预测 来临 天 产生 风能 可利用 性 水平 所述 计划 优选 天 中 设置 减少 数量 恒定 能量 输出 时期 输出 时期 中 任一 时期 能量 传递 水平 恒定 存在 风速 风能 利用 性 水平 波动 摆动 稳定力 动量 	稳定
提供 种 阀 选择 改变 阀 中 流动 通道 尺寸 调节 阀 流体 流量 示例 性 实施 例中 阀 包括 限定 空腔 带有 延伸 进入 空腔 入口 出口 外壳 隔膜 定位 空腔 之中 至少 部分 隔膜 限定 至少 部分 流体 通道 相对于 隔膜 固定 多个 电极 相对于 外壳 固定 多个 电极 隔膜 能被 静电 驱动 调节 阀 流体 流量 	稳定
发明 公开 种 新型 吸水 速 干 纤维 生产 方法 生产 织物 方法 碱 溶性 聚酯 成 孔剂 成纤 聚合物 进行 混 纺丝 制得 吸水 速 干 纤维 制成 织物 经碱 减量 处理 发明 产品 具有 良好 吸水 速 干 性能 芯吸 高度 达 水分 蒸发率 	稳定
发明 公开 种 水泵 自动 控制 电动机 多功能 保护 电路 用于 制造 单相 电机 全功能 保护器 保护 启动器 水泵 保护 自动 控制器 许多 产品 采用 集成 技术 处理 后 具有 体积 小 重量 轻 灵敏度 高 可靠性 好 特点 广泛 采用 节省 人力 财力 物力 	稳定
发明 磁场 吸引 防止 装置 具备 产生 接近 检测 磁场 接近 检测 磁场 强度 变动 检 测出 磁体 磁共振 诊断 装置 接近 接近 检测 部件 上述 接近 检测 部件 检 测出 上述 磁体 接近 情况 对应 防止 上述 磁体 上述 磁共振 诊断 装置 磁场 吸引 防止 部件 预防 磁场 	稳定
发明 提供 种 开关 电源 装置 输出 变换 直流 电源 电压 直流 输出 电压 开关 电源 装置 中 直流 输出 电压 基准 电压 进行 比较 直流 输出 电压 越大 值越 小 反馈 信号 输出 电流 越 值越 小 电流 检测 信号 小 比较 信号 三角 波 信号 比较器 进行 比较 信号 控制 半导体 开关 导通 截止 由此 提供 提高 电流 限制 动作 精度 需要 电流 检测 电路 驱动器 高速 动作 稳定 电流 限制 动作 时 输出 电压 带有 电流 限制 功能 进行 电压 控制 开关 电源 装置 	稳定
种 热水器 包括 水 容器 具有 冷水 入口 热水 出口 所述 水 容器 相邻 燃烧室 所述 容器 联接 燃烧器 所述 水 容器 联接 温度 探测器 用于 检测 所述 水 容器 上部 水温 用于 激活 所述 燃烧器 控制器 所述 控制器 建立 初始 水温 设 定点 所述 热水器 燃烧器 激活 时 检测 水温 所述 设定 点 进行 比较 所述 燃烧器 处于 激活 时 水温 下降 小于 选 定量 使 所述 设定 点 降低 第一 选 定量 所述 燃烧器 处于 激活 时 水温 下降 大于 选① 定量 使 所述 设定 点 升高 第二 选 定量 	稳定
种 夹紧 元件 形成 夹紧 元件 方法 夹紧 元件 包括 锁定 夹紧 元件 弹性 架 多边形 螺母 多边形 螺母 相互 作用 紧固 螺钉 螺母 无 旋转 方式 保持 弹性 架 中 	稳定
种 保持 低 重复 频率 短 脉冲 信号 偏振 方向 能量 稳定 装置 包括 连续 光纤 激光器 脉冲 发生器 偏振 控制 单元 检偏器 光纤 分束器 反馈 单元 数字 控制器 信号 同步器 所述 偏振 控制 单元 偏振 控制 模块 驱动 电路 构成 驱动 电路 偏振 控制 模块 提供 驱动 电压 所述 反馈 单元 依次 光电 探测器 积分 电路 高速 电 放大器 高速 采集 卡 构成 发明 装置 保持 低 重复 频率 短 脉冲 信号 偏振 方向 输出 能量 稳定 发明 具有 结构 简单 控制 精确 易于 系统 集成 特点 稳定力 动量 	稳定
种 电池 高温 状况 预防 保护 方法 系统 电池 单元 整合 整合 后 搭 接到 主机 电器 装置 用以 电池 单元 提供 高温 状况 预防 保护 功能 特点 在于 利用 温度 阈值 放电 方式 进行 电池 预防 保护 工作 特点 可让 主机 电器 装置 处于 开机 关机 状态 下 均可于 电池 单元 进入 过高 温度 之前 提前 消耗 电能 令 电池 单元 不致 高 温度 引起 电池 单元 异常 现象 损毁 膨胀 爆炸 	稳定
	稳定
用于 生成 稳定 频率 线梳 或用 超短 激光 脉冲 序列 方法 设备 用于 稳定 载波 相对于 周 期 激光 脉冲 振幅 包络 位置 借助于 相同 非线性 晶体 中 差 频生 成 相位 调制 生成 频谱 分量 之间 干涉 允许 检测 稳定 载波 包络 偏移 相位 时间 演化 描述 技术 很大 程度 上地 改善 稳定 准确性 具有 小 插入 损耗 	稳定
实用 新型 涉及 种 用于 气体 放电 灯 型 电感 镇流器 包括 铁芯 线圈 铁芯 中间 宽 两 头 窄 带状 硅钢片 卷绕 成 呈型 结构 铁芯 型铁 芯上 设有 近似 圆形 气隙 开口 气隙处 填充 耐高温 绝缘 片 铁芯 型芯 柱 附着 层 绝缘层 线圈 绕制 铁芯 绝缘层 型 电感 镇流器 具有 漏磁 小 功耗 低 噪声 小 温升 低 寿命 长 节能 效果 明显 优点 有效 克服 传统 镇流器 产品 存在 寿命 短 成本 高 环境 造成 污染 缺陷 	稳定
种 圆柱形 静压 导轨 机构 包括 圆柱形 静压 导轨 静压 导轨 两 端 设置 导轨 支座 静压 导轨 中部 安装 静压 导套 静压 导套 外轮廓 部分 球形 静压 导套 球面 柔性 连接件 连接 静压 导套座 静压 导 套上 设置 供油 接头 球面 柔性 连接件 使 静压 导套 静压 导套 座 之间 相对 转动 消除 锯框 变形 带来 不利 影响 实用 新型 有益 效果 摩擦 系数 低 刚性 好 运行 精度 高 导轨 使用 寿命 长 圆柱形 静压 导轨 机构 技术 方案 技术 方案 能够 有效 消除 安装 误差 锯 框 张 紧 变形 环境 冷热 变化 因素 静压 导轨 影响 使 静压 导轨 能够 可靠 运行 	稳定
实用 新型 公开 种 充气 轮胎 充气 轮胎 间隔 物 固定 充气 轮胎 内壁 形成 独立 气室 气室 独立 气阀 并由 导管 连接 充气 轮胎 气门 种 结构 充气 轮胎 具有 受损 后 瞬间 大量 漏气 充气 轮胎 保持 一定 气压 特点 使 车辆 轮 受损 后 正常 行驶 避免 意外 发生 	稳定
发明 提供 改进 可商 购 得到 有机 工作 流体 用于 有机 循环 发电 装置 单元 类似 系统 还用 作用 热 回收 介质 流体 类 有机 工作 流体 热 传递 流体 操作 工作 流体 包含 至少 种 高度 支化 重质异链 烷烃 两 种 多种 类 烃的 混合物 发明 有机 工作 流体 中 支化 异链烷 烃类 优选 子类 包括 含 个碳 原子 的烃 至少 甲基 排列 得到 高度 稳定 化合物 位置 	稳定
技术 淬火 工艺 改进 防止 工件 淬火 发生 变形 原 淬火 淬火 加热 流态炉 中 进行 零件 平放 夹具 入炉 温差 超过 保温 后 热油 中 冷却 工件 出现 收缩 倾向 椭圆 炉 使 零件 热处理 过程 中 尺寸 变化 规律 改进 工件 渗碳 中 装炉 摆放 方式 淬火 中 采用 型 胎 调整 件 尺寸 变化 量 工艺 方法 提高 零件 表面 质量 有效 降低 材料 消耗 成本 	稳定
发明 提供 种 涡旋式 流体 机械 能够 使旋转 涡轮 自转 方向 动作 稳定 化 容易 保持 润滑油 能够 降低 制造 成本 壳体 旋转 涡轮 之间 设置 组 防 自转 机构 防 自转 机构 相互 起到 作用 第球 式 联接 机构 构成 第球 式 联接 机构 承载 旋转 涡轮 推力 负荷 第球 式 联接 机构 承载 旋转 涡轮 自转力 	稳定
实用 新型 公开 种 双 内胎 轮胎 旨 提供 种 爆胎 后 继续 保持 车辆 平衡 行驶 减少 爆胎 发生 车祸 危险性 车用 轮胎 技术 方案 要点 外胎 壁 里面 至少 两 独立 内胎 共同 支撑 整个 轮胎 内胎 之间 改装 后 钢圈 分隔 固定 轮胎 橡胶 部分 填充 内胎 之间 空隙 两 内胎 分别 充气 充气 充气 开口 位于 轮胎 侧 	稳定
发明 提供 种 稳定 控制 取向 硅钢 终轧 温度 方法 增加 中间 坯厚度 取向 硅钢 相同 成品 规格 钢种 中间 坯厚度 增加 精轧 前 中间 坯头 尾 采用 单排 除鳞 精轧 机架 间 冷却水 采取 依次 打开 浇水 方式 精轧 采取 升速 轧制 抛 钢 速度 减少 终轧 温度 波动 保证 取向 硅钢 终轧 温度 控制 稳定性 使 取向 硅钢 终轧 温度 波动 范围 稳定 控制 在℃ 以内 改善 取向 硅钢 磁性 发明 方法 简单 易于 掌握 便于 操作 无需 投资 便可 迅速 见效 具有 重要 推广 使用 价值 稳定 热能 	稳定
种 浮式 平台 包括 船体 安装 船体 最上 端的 甲板 平台 一些 钢筋 束 锚固 海床 钢筋 束 上端 船体 相连 下端 固定 海床 平台 包括 拆卸 压 舱 装置 压 舱 装置 提供 附加 浮力 安装 期间 平台 进行 压舱 时 能够 不使用 起重 驳船 情况 下 平台 获得 流体 静力 稳定 	稳定
发明 提供 种 机床 夹具 属于 机械 加工 领域 解决 现有 夹具 存在 工作 性能 不稳 结构 复杂 工作 效率 高 问题 机床 夹具 包括 块 固定 板 设置 固定 板 固定 钳和 活动钳 固定 钳和 活动 钳上 分别 设有 相对 置 钳口 所述 固定钳 卡槽 结构 安装 固定 板上 活动钳 驱动 机构 作用 下相 固定钳 移动 机床 夹具 结构 简单 工作 效率 高 应用 范围 广 工作 稳定 可靠 	稳定
发明 涉及 种 供 料盘 固定 防呆 治 具 治 具 用于 固定 两 两 以上 托料盘 所述 托料 盘 侧边 具有 外侧 突出 凸边 治 具 包括 第一 固定 件 所述 第一 固定 件 侧 具有 多个 相 间隔 设置 凹部 凸部 间隔 设置 凹部 凸部 两 端 部 凸部 所述 凹部 宽庋 所述 托料 盘 凸边 宽度 相 匹配 两 端 所述 凸部 宽度 相等 发明 凹 凸部 结合 凹部 托 料 盘 凸边 固定 防止 托料盘 发生 移动 两 端 不等 宽度 凸部 防止 托料盘 放置 位置 发生 颠倒 避免 上料 时 极性 发生 颠倒 	稳定
发明 涉及 高速 主轴 平衡 装置 具体 高速 主轴 在线 动 平衡 装置 解决 现有 在线 动 平衡 装置 特别是 间接 在线 动 平衡 装置 混合型 在线 动 平衡 装置 存在 缺陷 不足 包括 含有 部 圆周 表面 设有 铁磁 材料 层 滑 盘 座 定子 间接 在线 动 平衡 机构 包括 含有 定子 固定 定子 传感器 套 滑 盘 座 两 端 部 滑盘 固定 滑盘 平衡 质量 块 套 主轴 滑 盘 座 滑 盘 端面 接触 压板 混合型 在线 动 平衡 机构 压板 侧 设有 电磁 线圈 压板 侧 端面 附着 铁磁 材料 层 压板 侧 设有 固定 主轴 轴套 轴套 压板 之间 设有 套 主轴 弹性 元件 平衡 装置 具有 响应 时间 短 节能 特点 实现 实时 节能 高速 主轴 在线 动 平衡 补偿 效果 	稳定
实用 新型 公开 种 电梯 平衡 补偿链 包括 金属 链条 金属 链条 链环 中 纵向 穿 装 软 质绳 实用 新型 结构 合理 柔软 性能 好 弯曲 直径 小 使用 寿命 长 电梯 运行时 噪声 小 制造 工艺 简单 成本 低廉 	稳定
本本 发明 公开 种 高精度 自由度 稳定 平台 平台 主要 包括 上层 平台 中层 平台 下层 平台 曲柄 曲柄轴 曲柄 连接件 中层 大轴 部件 实现 绕轴 转动 绕轴 转动 两 自由度 运动 实现 任意 两 自由度 复合 运动 试验 平台 稳定 性好 精度 高 结构 紧凑 整体 高度 低 种 针对 海况 条件 动态 条件 下 运动 过程 仿真 模拟 装置 适用于 航空 航天 兵器 船舶 电子 国防 工业 产品 测试 	稳定
实用 新型 公开 种 具有 冷冻 冷藏 空气 调节 双 重 功能 一体机 空气 调节 冷藏 冷冻 装置 分别 设置 立方体 两 部分 两部分 温控器 分别 控制 回路 中 电磁阀 实现 一体机 自动 控制 手动 控制 只 选择 种 功能 停止 功能 实用 新型 解决 冷冻 冷藏 物品 进行 空气 调节 两 种 设备 矛盾 节约 占地 面积 	稳定
种 部分 氧化 气态 含烃 燃料 制备 合成 气 过程 中 燃烧器 件 端部 稳定 火焰 方法 方法 包括 以下 步骤 燃烧器 反应器 提供 气态 含烃 燃料 调节 气体 氧化剂 调整 调节 气体 质量 流量 调节 气体 浓度 超过 预定 极限 创造 工艺 条件 使 火焰 接触 燃烧器 件 端部 火焰 燃烧器 件 端部 上升 时 再 调整 燃料 氧化剂 调节 气体 速度 质量 流量 再次 火焰 稳定 燃烧器 件 端 部上 步骤 中 调节 气体 浓度 超过 步骤 中 所述 极限 	稳定
种 地震 自动 避险 床 包括 床支架 床支架 分别 安装 床板 床 靠背 床 靠背 连接 落球筒 钢球 安放 托 球架 床支架 前部 顶端 连接 悬吊 器 支 承架 悬吊 器 支承 架 分别 设置 在床 靠背 撞击 开启 器 安装 支架 相铰连 撞击 开启 器 前部 落球筒 下口 相 对应 后部 悬吊 器 相配 合并 接触 床支架 前部 连接 定位 轴 拐 臂 安装 定位 轴上 相互 之间 相 铰连 拐 臂 上端 床 靠背 相 接触 下端 床板 前端 相 对应 实用 新型 能够 一定 程度 避免 地震 发生 时 处于 睡眠 人们 危险 广泛 应用 能够 一定 程度 减轻 地震 灾害 人们 伤害 	稳定
实用 新型 属于 机械 零件 技术 领域 具体 讲 涉及 弹簧 改进 技术 实用 新型 金属 线材 螺旋 缠绕 成 金属 线材 截面 尺寸 线材 长度 方向 小到大 逐渐 变化 金属 线材 截面 圆形 方形 规则 图形 弹簧 匝数 匝 实用 新型 承受 压力 范围 震动 范围 较广 小 压力 震动 情况 下 反应 柔软 灵敏 压力 震动 情况 下 表现 刚性 弹力 	稳定
实用 新型 公开 种 电缆 防盗器 包括 壳体 壳体 合页 连接 下 壳体 壳体 下 壳体 闭合 时 呈 管状 壳体 内壁 设置 防盗 夹 所述 防盗 夹 包括 弹性 连杆 设置 弹性 连杆 端 部 锁紧 件 所述 锁紧 件 底部 设有 斜向 咬齿 实用 新型 结构 巧妙 合理 使用 方便 种 广泛 安装 电缆线 护套 管内 起到 防盗 作用 电缆线 防盗器 	稳定
发明 解决 课题 具体 公开 种 工业 蒸发 装置 使 液体 中 含有 液体 沸点 低 物质 液体 导向 器 外部 表面 流下 期间 使该 低 沸点 物质 蒸发 装置 使 蒸发 处理 液体 小时 吨 以上 工业 规模 长期 稳定 实施 进一步 具体 公开 种 一部分 液体 长期 滞留 引起 变性 问题 工业 蒸发 装置 发明 者们 发现 解决 上述 课题 容易 提供 高品质 高 纯度 浓缩 液体 缩合 类聚 合物 热塑性 聚合物 	稳定
发明 提供 种 涡旋式 流体 机械 能够 使旋转 涡轮 自转 方向 动作 稳定 化 容易 保持 润滑油 能够 降低 制造 成本 壳体 旋转 涡轮 之间 设置 组 防 自转 机构 防 自转 机构 相互 起到 作用 第球 式 联接 机构 构成 第球 式 联接 机构 承载 旋转 涡轮 推力 负荷 第球 式 联接 机构 承载 旋转 涡轮 自转力 	稳定
新型 衣架 特征 衣架 后方 安装 吸盘 栏杆 地方 吸盘 吸 玻璃 方便 晾晒 衣服 	稳定
