导电 件 螺旋 弹簧 使 火花塞 端部 点火 线圈 连接 端相 连接 部件 帽 插 塞 套 衬 套 并从 端部 延伸 高压塔 绝缘 件 包覆 第一 排 气孔 帽 凸缘 部 表面 表面 紧密 接触 点火 线圈 体 底 表面 限定 第一 排 气孔 容积 多个 蓄水 空间 第一 排 气孔 相互 隔开 形成 环状 第二 排 气孔 形成 帽 使 第一 排 气孔 塞孔 内部 间 相 连通 提供 种 汽缸 头 经受 高压 水 时能 防止 水 排 气孔 进入 塞孔 用于 连接 火花塞 点火 线圈 结构 	分离
种 螺纹 接头 损害 密封 性能 条件 下 防止 擦伤 发生 缩短 滑动 距 箱 形 密封 部分 销形 密封 部分 短 环形 槽用于 排放 胶状物 销形 密封 部分 箱 形 密封 部分 短 情况 下 前段 无 螺纹 部分 倾斜度 销形 密封 部分 小 阳 螺纹 销形 密封 部分 之间 形成 销形 密封 部分 箱 形 密封 部分 锥度 更大 箱 形 部分 距离 接触 正切 销形 密封 部分 距离 更大 	调控
滚动 体 轴承 设置 涡旋式 压缩机 偏心 驱动 销轴 滑动 块 之间 滚动 件 提供 滚动 摩擦 使 静摩擦力 边界 润滑 摩擦力 减小 数量级 轨道式 运行 涡旋 体 容易 进入 侧面 接触 侧面 脱离 运动 涡旋 体 分离 发生 停机 过程 初始 阶段 	稳定
种 带有 主 滑阀 相关 副 滑阀 双 导管 滑阀 驱动 装置 上述 滑阀 拉杆 可绕 枢轴 转动 安装 滑阀 阀 壳 双臂 连杆 连接 滑阀 移动 关闭 位置 时 滑阀 移动 开启 位置 上述 双臂 连杆 具有 固定 拖动 轴承 连杆 两 臂 分别 做出 承接 设置 相关 拉杆 导向 机构 滑动 导引 机构 导引 机构 结构 协调 而使 主 滑阀 副 滑阀 每个 相对 位置 整个 滑阀 机构 保持 恒定 压力 差 	稳定
种 干燥 工艺 技术 特别 适用于 局限于 食品 包括 以下 步骤 使 外界 空气 升温 变暖 外界 空气 送入 只 干燥器 相连 初级 换 热器 空气 冷却 除水 重新 加热 把在 步骤 中 生成 暖干 空气 送入 热 回 收盘 空气 温度 升高 相对 湿度 降低 步骤 中 生成 热干 空气 吹 穿过 产品 足够 长 时间 获得 要求 干燥 效果 把在 步骤 中 生成 暖湿 空气 排入 大气 	调控
发明 涉及 种 改进型 软管 夹持器 包括 配 备有 夹紧 装置 外部 环形 夹 紧带 条 夹 紧带 条 表面 延伸 弹性 带条 弹性 带条 设置 两 围绕 条 延伸 轴向 间隔 边缘 凸圈 上述 凸圈 中间 弹性 带条 形成 向外 凸脊 凸脊贴 合于 夹紧 带条 表面 开口 凸脊 分成 桥 形物 桥 形物 弹性 条 周围 前述 凸圈 相 接合 桥 形物 设置 成 使 凸圈 径向 方向 轴 方向 移动 	稳定
种 内燃机 活塞 绕 枢轴 摆动 活塞 远离 枢轴 端 连杆 相连 驱动 连杆 活塞 具有 第一 圆弧 密封 表面 径向 偏离 第一 圆弧 表面 第二 圆弧 表面 上述 第一 圆弧 表面 底板 相连 第一 圆弧 密封 表面 密封 燃烧室 相应 圆弧 壁面 形成 燃烧室 壁 面的 第二 圆弧 密封 表面 密封 加压 室 壁面 内燃机 压燃式 火花塞式 冲程 冲程 	调控
发明 主题 防止 离心式泵 进水 腔 底面 后 壁上 产生 旋涡 简化 装置 装置 具有 条 希望 横截面 进水 腔 底面 延伸 泵进 水管 延伸 中心线 凸脊 横 截面 高度 宽度 泵进 水管 延伸 中心 轴线 侧 部分 相对于 泵进 水管 直径 限定 	稳定
种 用于 显示 启动 过程 中 透平 运行 状况 方法 中 发明 条 透平 特定 参数 运行 相关 参数 中 得出 基准 曲线 旁 显示 透平 转速 随时 间 变化 曲线 确定 条 透平 特定 参数 中 推导 启动 特性 曲线 基准 曲线 启动 特性 曲线 借助 运行 相关 参数 一定 数量 已 存储 启动 特性 曲线 中 求 	检测
种 冷柜 照明 装置 具有 照明 装置 冷柜 照明 装置 特征 在于 具有 插座 插座 具有 端板 侧面 设有 插入 荧光灯 端 部 插座 第筒 部 端板 设有 上述 第筒 部 同心 第筒 部 外 圆周 面 形成 环状 间隙 第筒 部 第罩 端部 插入 上述 间隙 中 第罩 端部 嵌套 第筒 部 外周 	产生
种 操作 辅助 装置 具有 正反 方向 操作 操作 工具 上述 操作 工具 成一体 移动 机械式 连接 机构 相 连接 可在 正反 方向 动作 操作 对象 辅助 上述 操作 对象 动作 驱动 操作 手段 检测 上述 操作 工具 操作 操作 状态 操作 方向 操作 状态 检测 手段 上述 操作 状态 检测 手段 检测 信息 控制 上述 驱动 操作 手段 控制 手段 检测 上述 操作 工具 对应 操作 负载 操作 负载 检测 手段 	调控
种 密闭式 电动 压缩机 含 氯的氟 碳氢 类 冷媒 多元 醇酯类 油 多元 醇醚类 油 极性 高 油为 基油 冷冻 机油 封入 密闭 容器 中 密闭 容器 中 收容 压缩 部 电动机 部 上装 电动机 部 供电 气密 端子 电动机 部 导线 连接器 连接 端子 连接器 壳体 聚对苯二 甲酸 丁二醇 酯或聚萘 甲 酸 丁二醇酯 合成 树脂 形成 接在 气密 端子 连接器 插座 端子 磷青铜 母材 电镀 工序 中 表面 无氯 镀锡 形成 	稳定
往复 式 液体泵 结构 种 改进 利于 泵从 工作 场地 拆卸 情况 下 维修 保养 一些 强烈 磨损 泵 部件 泵 具有 螺纹 可拆卸 泵体 入口 外壳 活塞 活塞 压盖 密封垫 活塞 单向 球阀 入口 单向 球阀 活塞 单向 球阀 座 入口 单向 球阀 座 单向 球阀 外壳 	移动
种 软管 紧固 包括 壳体 适于 安装 软管 带体 端 安装 壳体 端 插入 壳体 中 带体 形成 螺纹槽 安装 壳体 具有 螺纹 螺钉 元件 螺纹 带体 螺纹槽 相互 接合 旋转 螺钉 元件 用力 拧紧带 使 软管 固定 到任 需 位置 覆盖 带体 端 方式 装 带体 端 盖帽 	稳定
发明 目的 在于 提供 种 线性 致 动器 线性 致动 器 具有 轴线 方向 贯通 贯通 孔 上面 制成 开口 致动器 本体 组 端 块 可向 方向 来回 运动 滑动 台 连结 固定 端块 连通 流体 进出口 通路 组 筒状件 滑动 台 变位 连结 件 相对 上述 连结 件 固定 上述 圆筒 件 之外 周面 围成 气密 滑动 变位 盖 件 上述 盖 件 闭塞 连通 上述 通路 压力 室 	调控
发明 可获得 需要 导管 用于 有效 建造 具有 较大 规模 空间 房间 换气 系统 送 风 单元 送 风 单元 腔 室内 装有 送 风机 腔室 侧 面上 形成 吸气 口 腔 室 侧 面上 设有 支撑 喷嘴 可挠性 支撑 体 送 风机 喷出 喷流 引诱 输送 周围 空气 喷嘴 挠性 支撑 体 支撑 自由 改变 喷出 方向 送 风 单元 种类 数目 设置 场所 视 需要 做 适当 选择 简单 建造 无 浪费 效率 高 换气 系统 	移动
发明 旨在 提供 种 双 电磁铁 控 制式 电磁阀 用作 电磁铁 控制阀 安全型 双 电磁铁 控 制式 电磁阀 两 先导 阀 通电 主阀芯 切换 主阀芯 轴 端 设有 第活 塞 端 设有 第活 塞 及第 活塞 活塞 直径 相同 第活 塞 直径 小于 活塞 活塞 先导 流体 电磁铁 机构 使 先导 流体 作用 活塞 双方 时 作用 小 直径 活塞 时 设置 切换 装置 上述 两 种 状态 下 切换 	调控
发明 提供 种 用于 自动 传输 铜合金 制成 耐磨 同步 环 铜合金 组成 包括 重量 重量 	产生
发明 公开 种 图像 处理 装置 台 电机 进行 原稿 记录 纸 传送 切断 机构 原稿 记录 纸 传送 特征 在于 第摆 动 齿轮 机构 电机 驱动力 选择 传递 分页 滚子 齿轮 送纸 滚子 齿轮 压印 滚子 齿轮 第摆 动 齿轮 机构 第摆 动 齿轮 机构 断续 电机 旋转 力 第摆 动 齿轮 机构 传递 切断 驱动 齿轮 限制 板 第和 第相 接 部 限制 摆动 齿轮 机构 动作 转换 电机 旋转 力 传递 方向 电机 旋转 方向 限制 板 位置 控制 	移动
种 铰链 紧固 结构 形成 铰链 箱 形 截面 铰链 柱 连接 方法 包含 铰链 柱 外 板 伸入 铰链 柱 板 紧固件 紧固件 包含 螺距 相等 直径 第一 第二 螺纹 部 分别 靠近 紧固件 头部 尖部 紧固 结构 方法 用于 形式 构件 连接 箱形 截面 结构 	稳定
扩张 管端 时 使用 种 工具 工具 包括 相对于 中心线 径向 移动 爪 爪 缩回 位置 时 插入 管端 中 一定 距离 爪 具有 外爪面 爪 缩回 位置 相互 邻近 具有 用于 接触 管端 表面 横截面 圆拱 形的 形状 外爪 面 中心 线 径向 距离 爪 插入 端向 相对 端 增大 管端 小 爪 运动 分 级 相继 扩张 扩张 级 间 爪 缩回 并进 步 插入 管端 工具 爪 径向 移过 小于 管端 最后 径 小 扩张 距离 	调控
移动 处理 板材 带材 转向 装置 利用 围绕 圆柱形 表面 形成 气垫 圆柱形 表面 里面 下方 形成 气垫 吹气 装置 红外 发射器 射线 射向 板材 转向 部分 体积 合并 板材 转向 装置 特别 用于 干燥 加热 装置 吹动 气流 形成 气垫 保证 红外 发射器 冷却 装置 特别 应用于 如纸 织物 合成 薄膜 材料 制造 加工 处理 	调控
发明 涉及 用于 冷藏箱 保温瓶 保温 饭盒 器具 绝热 容器 制 绝热 容器 绝热 材料 绝热 容器 制法 绝热 容器 内外 容器 接合 一体 夹层 容器 内外 容器 间 形成 绝热层 内外 容器 之间 夹层 里 装配 氙 氪 氩之中 至少 种 低 导热 性 气体 气袋 绝热 材料 绝热 容器 制法 气袋 插入 夹层 气袋 充填 低 导热 性 气体 气 袋 随之 密封 	调控
具有 底座 底座 连接 弹性 止动 件 固定 螺母 用于 构件 管道 固定 剖面 形的 型钢 止动 件 具有 直径 对置 制动片 可绕 转轴 转入 型钢 槽口 中 阻止 固定 螺母 转动 制动 片上 突起 便于 手工 型钢 内部 旋转 固定 螺母 	稳定
种 吸收式 制冷机 包括 吸收器 蒸发器 发生器 冷凝器 热交换器 溶液 回路 连接 部件 制冷剂 回路 浓 溶液 发生器 溶液 喷射泵 引导 吸收器 溶液 喷射泵 设有 用于 指示 传感器 检测 液态 制冷剂 液位 信号 溶液 浓度 信号 控制 泵的 转速 使 制冷剂 溶液 安全 有效 循环 控制器 	调控
内燃机 点火 线圈 主要 变压器 部分 控制 回路 连接 部 组成 变压器 部分 开敞 磁路 磁体 次级 线轴 线圈 初级 线轴 线圈 组成 铁芯 断 面积 之间 磁体 断 面积 铁芯 断 面积 比率 铁芯 轴 长度 初级 次级 线圈 卷绕 宽度 之比率 卷绕 宽度 可使 产生 电能 增大 增加 尺寸 	调控
种 涡旋型 流体 机械 涡卷 卷板 前端 设置 末端 密封 件 末端 密封 件 聚苯 撑 硫 材料 配入 碳素 纤维 填充 材料 构成 复合 塑料 制成 使由 铝材 制造 涡卷 部件 末端 密封 件 材料 碳素 纤维 调和 比例 铝材 进行 表面 处理 或由 铁 系 金属 铁系 金属 进行 表面 处理 制成 涡卷 部件 末端 密封 件 材料 碳素 纤维 调和 比例 高 减小 相互 组合 末端 密封 件 端板 间的 磨损量 使 双方 磨损 同等 进行 	结合
种 用于 小型 挖掘机 流体 动力 控制 系统 第一 控制 分段 包括 第一 第二 控制阀 分别 连接 第一 第二 执行 功能 串联 第一 压力 工作 流体 源 齿轮泵 主要 连接 第一 机具 驱动器 供液 第二 压力 工作 流体 源 第一 第二 控制阀 之间 互联 通道 供应 工作 流体 种 设置 优点 在于 中性 位置 选定 相关 功能 位置 之间 切换 第一 控制阀 可改变 执行 功能 之间 液流 分配 关系 	调控
种 用于 夹紧 根 轴上 锁定 装置 包括 套环 紧固 轴上 环 套环 具有 端壁 延伸 环 外倾 斜接 触面 上面 轴向 部位 环 套环 端壁 具有 接触 轴 外表 面的 内接 触面 套环 滑动 径向 面 环 分开 设置 套环 轴向 部位 螺纹 孔 中 螺纹 元件 拧入 顶 环 外接 触面 促使 内接 触面 轴上 施加 夹紧力 	稳定
涡旋式 压缩机 供油 结构 具有 设在 旋转 涡旋 主 框架 之间 密封 件 背压室 轴承 部分 隔开 并使 轴承 部 输出 压力 第供 油 通路 处于 输出 压力 下 润滑油 部 曲柄轴 直 通到 曲柄 部 端部 空间 第供 油 通路 曲柄 部 端部 空间 旋转 涡旋 端板 内连 通到 低压部 并在 油路 中间 具有 减小 通路 面积 节流 部 第供 油 通路 第供 油 通路 途中 曲柄轴 外周 面 开口 利用 曲柄轴 旋转 产生 离心泵 作用 主轴承 部 供油 	调控
种 单相 感应 电机 电机 包括 主 绕组 主 绕组 构成 电 角度 辅助 绕组 起动 继 电器 辅助 绕组 连接 起动 电容 多个 起动 电容 并联 工作 电容 连接 断开 工作 电容 继电器 电机 电源 切断 时使 继电器 闭合 控制器 发明 单相 感应 电机 克服 现有 技术 问题 特别是 每次 连接 断开 工作 电容 时有 电流 继电器 触点 清除 电弧 发明 单相 感应 电机 能以 起动 转矩 获得 高效率 电机 工作 	调控
双 效 吸收式 冷水 热水 产生 机器 包括 吸收器 低温 产生 器 冷凝器 高温 热 交换器 低温 热 交换器 具有 冷 热 转换 阀 旁路 用于 气态 制冷剂 高温 产生 器 直接 送入 蒸发器 具有 冷 热 转换 阀 旁路 用于 液态 制冷剂 蒸发器 直接 送入 稀 溶液 循环 系统 装有 高压泵 低压泵 制冷 操作 中 驱动 两 泵 加热 操作 中 驱动 高压 泵并 关掉 低压泵 	调控
发明 提供 种 罐 座板 成型 加 工时 极少 产生 料 头 部分 进行 爪 挤紧 工序 热交换器 罐 做成 端 开口 断面 呈 拐 字形 箱状 使 两 座板 闭塞 罐 开口 侧 端部 接合 管道 插通 座板 设 孔 里 管道 支承 固定 座板 上述 罐内部 连通 上述 断面 呈 拐 字形 箱状 展开 成 平面状 展开 金属板 坯料 折弯 折弯 部钎 焊接 合 构成 上述 罐 座板 	调控
种 接头 插入 管子 接头 本体 弹性 夹 圈 多个 夹紧 片 内侧突 设有 咬住 管子 外壁 爪部 接头 本体 内周面 管子 外周 面间 进行 密封 用的 弹性 密封圈 接头 本体 内壁 形成 接头 本体 内侧 方向 扩径 内锥面 沿轴 可移动 嵌 装在 接头 本体 弹性 夹圈 密封圈 之间 设有 上述 锥面 倾斜 角度 角度 接头 本体 内侧 扩大 外 锥面 倾斜环 具有 容易 制造 防止 爪部 过份 咬住 插入 外壁 优点 	稳定
水平 平面 转动 空气 出口 件 空气 释放 部分 形成 倾斜面 主体 倾斜面 相连 禁止 空气 流过 壁 主体 中的 叶片 安装 使 引导 表面 面对 管道 垂直 延伸 段 延伸 方向 垂直 延伸 段 延伸 方向 成 直角 延伸 叶片 中 相邻 两 叶片 端部 位于 空气 释放 部分 相对 侧 所述端部 设置 两 之间 深度 级差 位 垂直 延伸 段 较远 一侧 叶片 端部 位置 位于 垂直 延伸 段 较近 侧 叶片 端部 位置 深 	调控
种 具有 压缩 机构 室外 热 交换器 室外 电动 膨胀 阀 室内 热 交换器 冷冻 装置 压缩 机构 台 压缩机 并列 连接 成 压缩 机内 设置 排 油 机构 壳体 贮留 润滑油 达到 规定 量 时 润滑油 排出 	调控
外壳 安置 杠杆 可绕 转向 轴 回转 杠杆 槽口 支座 槽口 中 嵌入 条 牵索 牵索 加粗 端头 支撑 支座 杠杆 牵索拉引 回转 杠杆 突出部 突出部 牵索 延伸 方向 并在 形成 中间 空腔 情况 下 支座 相 对峙 端头 容纳 中间 空腔 中 传递 牵索 推力 倚靠 突出 部上 突出部 背向 支座 斜面 嵌在 槽口 中 牵索 端头 斜面 牵索 施行 拉力 时 端头 滑入 中间 空腔 中 操纵 装置 安装 简便 特别是 安装 汽车 	稳定
发明 提出 减少 含有 粒子 介质 引起 涡轮机 磨损 措施 减少 磨损 限定 叶轮 侧 空间 壁面 形状 设计 成 影响 固定 壁面 壁 处 介质 流 	稳定
种 燃机 供油 部分 汽化器 亦 喷油 系统 中 控制 对内 燃机 燃油 空气 供给 方法 装置 混合 空气 燃油比 运行 条件 自动 调节 理想 水平 旋转 速度 反馈 调节 电路 中 发动机 接收 旋转 速度 信号 反馈 控制 单元 短暂 控制 调节 装置 短暂 改变 混合 短暂 	调控
种 入流 侧 涡流 发生器 构成 燃烧器 借助于 混合 段 处 过渡 通道 使 气流 平滑 流入 混 合段 过渡 通道 包括 混合 段 端面 扇形区 数量 涡流 发生器 分体 数量 相当 流动 方向 呈 螺旋状 延伸 过渡 通道 下游 侧 气 膜 敷设 孔 穿通 混 合段 气膜 敷设 孔 用来 提高 管壁 气流 速度 混合 段 燃烧室 混合 段 燃烧室 之间 横截面 突变 区 形成 回流 区 	结合
种 接线 连接 装置 备有 卡口 沟 埋入 式 天花板 电线 盒 带卡 锁 接线柱 电线 盒 固定 天花板 卡锁从 电线 盒 卡口沟 下方 转动 接线柱 接线柱 电线 盒 进行 机械 连接 卡 锁 电线 盒 电 端子 部 进行 电 连接 电线 盒 下侧 突设 防止 误 连接 凸缘 使 电线 盒 电压 接线柱 上部 接触 时能 阻止 接线柱 卡锁 插入 卡口沟 插入 凹部 以使 凸缘 插入 电线 盒 相同 电压 接线柱 上部 使 接线柱 卡锁 插入 卡口 沟内 	稳定
公开 种 离子 增强 真空 干燥 方法 特别 有益地 用于 离子 灭菌 工艺 抽真空 干燥 方法 表现 明显 改进 灭菌 物品 放置 密封舱 室内 舱室 抽真空 舱室 抽空 步骤 期间 产生 剩余 气体 物质 等离子 促进 物品 干燥 有益地 使 获得 要求 压力 不用 等离子 情况 快捷 舱室 注入 灭菌 气体 产生 第二 离子体 激活 灭菌 气体 离子 使 舱室 物品 灭菌 	移动
发明 涉及 种 工作面 运输机 刨煤 装置 用的 传动 装置 具有 每个 异步 电动机 过载 保护 传动 机构 附设 平板 离合器 构型 过载 离合器 组成 传动 单元 传动 单元 中 传动 机构 有利 构 负载 平衡 传动 装置 发明 借助于 电子 控制 装置 实现 平板 离合器 打开 时 电动机 无载 起动 附设 平板 离合器 电磁阀 控制 调节 开关 操作 使 工作面 运输机 刨煤 机械 实现 平缓 起动 	移动
种 冷却 燃气 蒸汽 轮机 装置 燃气轮机 冷却剂 设备 燃气 蒸汽 轮机 装置 包括 置于 燃气轮机 后面 余热 蒸汽 发生器 加热 面 置于 蒸汽 轮机 水 蒸汽 回路 中 良好 冷却 燃气轮机 特别 有效 利用 由此 获得 热量 达到 装置 高的 总 效率 按本 发明 冷却剂 冷却 设置 中间 回路 用于 冷却 冷却剂 第一 换 热 器 相 结合 置于 水 蒸汽 回路 中 第二 换 热器 结合 在一起 第二 换 热器 用于 传递 由此 获得 热量 	调控
发明 涉及 种 捆扎 包装物 锁紧 装置 捆扎 包装物 用于 散件 物品 打成 包以 种 柔性 件 捆扎 后 锁紧 柔性 件 具有 捆扎 方向 相 垂直 接头 部位 接头 部位 锁紧 装置 予以 搭接 锁紧 装置 含有 松开 连接 在一起 拴紧带 带上 具有 制动 拉紧 夹紧 机构 装置 含有 手柄 锁紧 装置 部件 固定 拴紧 自由 端上 部件 固定 在与 上述 共同 作用 栓 紧带 自由 端上 提供 种 构造 简单 操作 轻便 防范 意外 开 包并 具有 高度 安全性 装置 发明 提出 第一 部件 具有 制动齿 带状 件 第二 部件 闭锁 件 具有 供 第一 部件 插入槽 具有 突入 插入 槽中 止动 爪 弹性 杠杆 杠杆 插入 槽 伸展 自由 端 朝向 插入 槽内 背向 插入 起始点 端 闭锁 件 支承 回转 手柄 利用 手柄 杠杆 挠曲 第一 部件 脱离 啮合 利用 手柄 杠杆 亦 挠曲 第一 部件 啮合 锁紧 	稳定
种 往复 缸 包括 具有 其内 限定 条 槽 缸体 滑台 垂直 连接 滑台 下 表面上 接头 缸体 通孔 滑移 分别 通孔 限定 缸室 使 接头 响应 送向 缸 室 压力 流体 移动 活塞 滑台 下 表面 突伸 导向 装置 缸体 表面 突伸 相互 间 隔开 导块 多个 夹 导向 装置 导块 之间 滚动 球 	移动
具有 啮合器 汽车 起动机 操纵杆 端部 作用于 啮合器 啮合 器 包括 滑动 安装 啮合器 轴上 轴套 啮合器 容纳 操纵杆 端部 垫圈 确定 径向 间隙 安装 圆柱形 装配 支承 部上 垫圈 轴 支承 轴套 径向凸 肩上 轴套 第二 自由 端 至少 具有 装配 前 定位 支承 部 直径 小于 圆柱形 装配 支承 部 直径 	稳定
发明 涉及 种 电冰箱 运行 控制 回路 方法 电冰箱 冷藏 冷冻室 设 蒸发器 风扇 控制 风扇 运转 实现 室 快速 冷却 降低 制冷剂 用量 能源 消耗 发明 包括 第一 蒸发器 第二 蒸发器 第一 温度 传感 装置 第二 温度 传感 装置 第一 第二 风扇 第一 开关 装置 第二 开关 装置 用于 温度 传感 装置 检测 温度 控制 第一 第二 开关 装置 控制 部分 	调控
发明 涉及 种 冰箱 操作 控制 电路 方法 冷冻室 冷藏 室内 装有 蒸发器 台 风扇 台 风扇 控制 可使 室 快速 制冷 减少 制冷剂 用量 能量 消耗 发明 包括 第一 蒸发器 第二 蒸发器 冷冻 温度 传感器 冷藏 温度 传感器 第一 第二 风扇 第一 开关 装置 第二 开关 装置 控制 部分 	调控
发明 涉及 种 用于 轴线 移动 杆 伺服 马达 具有 液压 缸 液压 传动 装置 杆传力 连接 活塞 滑动 密封地 装 缸 杆传力 连接 并作 用在 传动 装置 压力 弹簧 伺服 马达 流入 区 释放 器 流入 区 可供入 液压 流体 释放 器 压力 区 孔 流入 区 连通 并与 传动 装置 相连 流出 区 液压 流体 流出 区 无 压力 排出 开关 元件 压力 区 流入 区 产生 正 压力 降时 开关 元件 压力 区 流出 区 连通 开关 元件 阻断 流出 区 杆 压力 弹簧 作用 下 缸 移出 液压 流体 供 入 流入 区 杆 拉入 缸内 种 伺服 马达 特别 适用于 驱动 蒸汽 动力 设备 中 见到 应用 种 提拉式 快速 关闭 阀 	调控
种 气动 致 动器 用来 控制 种 废气 驱动 涡轮 增压器 废气 闸阀 包含 导引 活塞 活塞 只 达到 要求 增压 压力 时 响应 增压 压力 打开 依此 避免 废气 闸阀 过早 打开 主致 动 活塞 一直 保持 大气 压力 下 直 获得 要求 致动 压力 	稳定
发明 提供 种 具有 佳 自吸 泵送 性能 自吸 离心泵 破坏 蜗壳型 离心泵 近乎 完整 形态 中 提出 双蜗壳 离心泵 说明 书中 揭示 种 自吸 作用 原理 绕 叶轮 周边 形成 螺旋形 蜗室 小 螺旋形 蜗室 特征 使 自吸 水流 循环 流动 叶轮 产生 旋涡 产生 气 水 混合物 排出 一直 以来 所作 努力 专注于 局部地 支承 吸水 流的 涡流 形成 龙卷风 型 空腔 底部 离心 方式 空气 吸 水流 中 分离 却 解决 伴随 种 努力 产生 附加 技术 问题 发明 吸 水流 分离 室 上部 中 形成 螺旋形 导引 通道 	分离
种 自动 空调 制冷 回路 冷凝器 蒸发器 式 热交换器 包括 若干 管件 管件 第一 平 面部 第一 平 面部 对置 第二 平 面部 第一 第二 平面 部内 表面上 加工 若干 突部 钻孔 法 突部 突出 平 端面 开 至少 孔 第一 第二 平 面部 突部 面对 排直 找齐 突出 平 端面 相 接触 使 第一 第二 突部 至少 孔 对着 种 结构 有效 提高 热交换 器 耐压 性能 增加 制造 成本 	稳定
种 低噪 换气 家用 空调机 属 致冷 工程 领域 空调机 整机 置于 室外 风管 室内 相接 综合 现有 窗式 空调机 分体式 空调机 优点 该机 工作 时 室内 噪音 低 自动 手动 进行 换气 室内 空气 清新 冷风 风向 可调 实现 机 供 现行 家用 空调机 最 理想 换代 产品 	分离
压缩 点火 往复 活塞 式 内燃机 直线 排列 气缸 气缸 发火 顺序 顺序 缸 缸 组 一起 进行 气缸 编号 发动机 气缸 排 端 顺序 进行 	产生
在此 使用 保护器 剖面 呈 圆顶 形的 容器 里 容纳 热敏 开关 机构 具有 容器 纵向 平行 凸缘 部 集合 接线匣 匣体 里 形成 复数 条 洞 条 洞 连接 电动机 接头 引线 可使 保护器 引线 销 部分 装入 接头 插座 装填 洞 保护器 引线 销 插座 部 装入 接头 洞 深处 时 集合 接线 匣上 形成 保护器 保护 部 卡住 保护器 凸缘 部 以使 保护器 容器 大部分 露出 集合 接线匣 外面 结合 成 密闭 型 电动 压缩机 保护 装置 	稳定
种 轴流式 鼓风机 包括 绕 转轴 旋转 相对 含 转轴 假想 平面 倾斜 转轴 方向 圆周 方向 气体 赋 若干 旋转 叶片 构成 旋转 叶栅及 气体 导引 旋转 叶栅 气体 导入 流道 流道 面对 旋转 叶栅 环状 断面 形状 外 周 直径 旋转 叶栅 外 周 直径 相同 旋转 叶片 促使 圆周 方向 流动 气流 轴线 方向 偏转 转轴 中心 线 假想 圆筒 面的 断面 形状 翘曲 角 旋转 叶片 周朝 周 外 周 之间 中间部 增加 	移动
种 用于 空调 装置 排水泵 下端 部 设置 吸入 口 上部 侧面 设置 吐出 口 泵本体 旋转 自如 收纳 上述 泵本 体内 旋转体 使 上述 旋转体 旋转 电机 构成 上述 旋转体 备有 轴部 板状 大径 叶片 板状 小径 叶片 中空部 圆盘 排 水泵 降低 气泡 发生量 具有 降低 噪音 效果 	分离
