实用 新型 涉及 种 容器 清洗 器 属于 工业 生产 专用 设备 用途 喷射 水流 进行 容器 表面 清洗 作业 目的 在于 提高 工效 清洗 质量 容器 清洗 器 机座 驱动 装置 旋转 盘 软管 靶矩杆 喷嘴 喷嘴 连杆 轴承 止 推垫 连杆 座 连杆 柱塞 丝杆 螺母 齿轮 齿条 水 封 组成 特征 在于 清洗 器 分别 轴向 径向 两 方向 喷射 水流 容器 端面 进行 平面 螺线 清洗 清洗 机 配合 容器 圆柱面 进行 圆柱面 螺旋线 清洗 容器 做到 确切 逐点 清洗 改变 靶矩杆 长度 调整 喷嘴 清洗 表面 射程 第二 实施 例所 涉及 容器 清洗 器 水 封 采用 高 水压 清洗 铁路 罐车 时 容器 清洗 器 专利 罐车 高压 射流 清洗 装置 配合 使用 	分离
发明 涉及 分解 对象 物 分解 方法 装置 所述 方法 下述 工序 构成 分解 某一 地区 得到 分解 对象 物 终止 分解 终止 分解 时 残存 未 分解 分解 对象 物搬 送到 地区 搬送 分解 对象 物 前述 地区 得到 分解 对象 物 前述 地区 进行 分解 前述 某一 地区 得到 分解 对象 物 前述 地区 得到 分解 对象 物是 物质 分解 对象 物 分解 装置 具备 地区 搬 送到 地区 未分 解 分解 对象 物 接收 接收 手段 前述 搬送 分解 对象 物 前述 地区 中 得到 分解 对象 物 前述 地区 分解 分解 手段 前述 某一 地区 得到 分解 对象 物 前述 地区 得到 分解 对象 物 物质 发明 高效率 多个 地区 污染 土壤 进行 净化 	分离
发明 提供 种 回油 方便 无须 配置 油 分离器 回油 系统 油位 控制 口 无 要求 油 直接 制冷剂 出管 回到 压缩 机中 运转 安全 可靠 壳管 蒸发器 包括 载 冷剂 设置 制冷剂 进管 制冷剂 出管 制冷剂 壳体 载 冷剂 制冷剂 壳体 下部 沸腾 区 穿过 制冷剂 进管 沸腾 区 相通 干 蒸发 区 设置 套管 载 冷剂 套管 穿过 套管 其内 穿过 载 冷剂 之间 间隙 制冷剂 出管 套管 管壁 相通 	分离
发明 涉及 种 微分析 芯片 进行 微液液 萃取 方法 装置 特征 微 芯片 微通道 萃取 体系 相互 间 不完全 相溶 流动 液相 固定 液相 构成 利用 分子 扩散 效应 流动 液相 固定 液相 溶解 效应 实现 萃取物 固定 液相 流动 液相 之间 萃取 固定 液相 中的 高 倍数 浓集 萃取物 试样 固定 液相 中的 聚焦 发明 优点 微分析 芯片 实现 高浓集 倍率 萃取 萃取 所需 试剂 试样 量 极少 萃取 系统 结构 简单 容易 操作 	分离
发明 提供 软骨素 提取 方法 鱿鱼 颈部 和/或鮟鱇 鱼 鱼 头骨 原料 净 骨 碱 浸 提液 共同 粉碎 软骨 碎末 ℃ 碱浸 提液 浸 提 过滤 后 滤液 中 加酶 ℃ 下 水解 酶解 完成 液冷 却 至℃ 后 离心 弃 沉淀 再 醋 酸钠 调节 清液 加入 清液 倍 体积 乙醇 继续 离心 沉淀 分别 丙酮 乙醚 洗涤 最后 沉淀 干燥 采用 发明 提供 软骨素 提取 方法 制造 软骨素 解决 软骨素 原料 来源 比较 稀缺 问题 水产品 加工 废弃 下脚料 特别是 数量 鱿鱼 颈部 鮟鱇 鱼 鱼头 骨 中 提取 软骨素 原料 充足 原料 成本 低廉 降低 软骨素 生产 成本 	分离
发明 公开 种 灵芝 提取 新 工艺 工艺 先 灵芝 氨 溶液 提取 两 次 再 用水 提取 次 滤过 合并 滤液 浓缩 即得 方法 提取 所得 产品 有效 成分 提出 率 显著 提高 咸味 方法 腐蚀 设备 	分离
单排 蒸发器 盘 管中 具有 接收 过热 状态 制冷剂 末尾 管子 设置 至少 导流 板 来使 过热 管子 空气流 转向 使 非 过热 管子 能够 空气 下游 之前 利用 非 热 管子 冷却 效果 干燥 空气 	分离
公开 分解 剂 分解 热固性 树脂 方法 方法 包括 以下 步骤 热固性 树脂 预热 预热 温度 预热 热固性 树脂 分解 剂 捏合 包含 热固性 树脂 分解 剂 混合物 加热 捏合 温度 分解 剂 热固性 树脂 之间 发生 反应 获得 分解 剂 已 消耗 捏合 物料 捏合 物料 加热 最高 温度 分解 热固性 树脂 预热 温度 高于 分解剂 沸虑 温度 捏 温度 低于 预热 温度 低于 热固性 树脂 热分解 温度 最高 温度 低于 热固性 树脂 分解 温度 温度 时间 下述 条件 下 进行 热固性 树脂 预热 	分离
实用 新型 涉及 种 高效 喷雾 旋流 脱硫 除尘 装置 特征 在于 包括 内设 反应 分离 装置 脱硫 除尘 塔 所述 脱硫 除尘 塔 塔壁 底部 设有 烟气 入口 设于 烟气 入口 塔壁 切线 方向 一致 烟气 进气 通道 烟气 进气 通道 设有 高效 喷雾 装置 所述 脱硫 除尘 塔 上部 设有 烟气 出口 所述 反应 分离 装置 旋流 装置 设于 旋流 装置 下侧 高效 喷雾 喷嘴 组成 装置 脱硫 除尘 效果 好 堵 灰 水 	分离
发明 涉及 种 消除 高压 断路器 二维 强加 速度 短程 震动 方法 特征 在于 断路器 框架 电路板 之间 设置 带有 弹簧 皱褶 区 平面 弹簧 平面 弹簧 配套 能量 消除 块 另加 超声波 吸收 层 组成 短程 震动 消除 机构 断路器 框架 电路板 之间 设置 平面 弹簧 能量 消除 块 超声波 吸收 层 为主 尤其是 带有 皱褶 区 平面 弹簧 构成 消除 短程 震动 机构 改变 断路器 操作 过程 中 产生 二维 强加 速度 短程 震动 振动 能量 传输 方向 加速 能量 衰减 真正 起到 消除 共振 作用 有权 	分离
种 油烟 机 清洗 装置 特征 在于 包括 清洗 程序 控制器 清洗 程序 控制器 包括 风轮 转速 控制 模块 水泵 开关 控制 模块 风轮 转速 控制 模块 输出端 电机 连接 转 信号 传送 电机 电机 转速 信号 对应 转速 运转 水泵 开关 控制 模块 输出端 水泵 连接 开关 信号 传送 水泵 水泵 开关 信号 开启 关停 种 油烟 机 清洗 装置 清洗 方法 包括 步骤 电机 启动 电机 带动 风轮 高速 运转 电机 带动 风轮 低速 运转 开启 水泵 清洗 喷嘴 喷出 清 洗液 电机 带动 风轮 中速 运转 关闭 水泵 清洗 喷嘴 停止 喷出 清 洗液 电机 带动 风轮 高速 运转 使 风轮 风干 关闭 电机 结束 清洗 工作 发明 具有 有益 效果 清洗 全面 清洗 效果 好 清洗 程序 控制器 控制 清洗 效率 高 使用 方便 可防止 清 洗液 外漏 有权 	分离
种 单梁 激振筛 最 适用于 建材 冶金 电力 煤矿 筛分 作业 筛 箱 两 侧 分别 设置 自同步 激振器 两 侧 激振器 分别 固定 穿过 筛 箱 底部 根 激振 梁上 激振 梁 穿过 筛 箱 底部 挡板 内侧 设有 多块 筛板 激振 梁 两 端 分别 设在 斜置 装有 隔振 弹簧 激振 梁 支架 采用 筛板 激振器 刚性 结构 筛 面 振动 均匀 避免 筛 箱 振动 现有 技术 相比 结构 简化 重量 减轻 设计 生产 周期 缩短 故障 少 生产 效率 高 具有 广泛 实用性 	分离
实用 新型 涉及 薯类 淀粉 分离机 特点 机架 侧 增设 次 分离 滚筒 机构 实用 新型 增设 次 分离 滚筒 机构 提高 产品 质量 光洁度 好 提高 生产 效率 每小时 破碎 量 达 公斤 出粉率 高达 以上 脱水 率 达 以上 次 分离 滚筒 机构 总成 拆装 容易 拆除 后 主机 单独 作业 实用 新型 小型 淀粉 加工 企业 粉丝 加工 企业 农户 用于 提取 淀粉 理想 加工 设备 	分离
种 吸 锡器 解决 现有 电 加热 吸 锡器 电 加热 后 气动 使 锡 点 熔化 气动 吸出 易 出现 过热 使 电路 烧毁 问题 吸 锡器 前部 安装 吸头 电 加热 使 锡头 溶化 锡点 锡 点 吸头 自动 吸入 吸入 甩出 使 锡 点 干净 彻底 吸净 伤 电路板 吸 头上 下 串动 挂 锡 部分 剪掉 更换 	分离
发明 提出 种 完成 长 类 长 轴类 零件 头部 种 加工 要求 综合 机 加工 机床 包括 机架 夹紧 装置 顶紧 装置 丝杆 螺母 轴 向进 系统 径向 刀架 径向 走 刀 系统 旋转 架 动力 箱 刀具 安装 旋转 刀架 作 径向 走 刀 轴 进给 改变 径向 走 刀 轴 向进 比例 完成 管端 轴 端 种 外园 端面 锥度 直 螺纹 锥螺纹 机 加工 发明 采用 工件 固定 刀具 旋转 形式 结构 紧凑 体积 小 重量 轻 造 价低 综合 加工 力强 加工 精度 高 完成 车床 加工 所有 工作 长 管子 水平 状态 垂直 状态 均能 加工 无需 基础 能够 适应 石油 钻井 海洋 采油 平台 油 气 水 管道 野外 施工 采油树 维修 加工 	分离
发明 提出 种 高耐 腐蚀性 钢材 引起 耐 腐蚀性 提高 元素 过剩 添加 所致 机械 特性 焊接性 降低 能够 具有 优异 耐 腐蚀性 特征 在于 含有 质量 质量 质量 含有 质量 质量 质量 中 任选 种 两 种 以上 钢材 最 表面 深度 Μ 区域 中 量 量 钢材 量 量 倍 以上 具有 质量 以上 稠化层 稠化层 厚度 Μ 以上 钢板 表层 部 特定 区域 中 平均 铁素体 结晶 粒径 Μ 以下 腐蚀 侵蚀 固体 	分离
种 分离式 空气 净化 装置 具有 净化器 制式 净化 执行 独立 操作 净化器 设置 净化 特性 相 适应 空间 中 增强 特定 污染物 净化 能力 净化器 结合 一体 污染 程度 实现 净化器 驱动 组合并 执行 净化 组合 操作 装置 组合 壳体 中 通风 模块 吸入 外部 空气 过滤 部件 净化 外部 空气 随后 摊 净化 后 空气 装置 包括 控制器 用于 控制 通风 模块 主 净化器 辅 净化器 电源 独立 操作 主 净化器 中 形成 输出端 辅 净化器 中 形成 输入端 装配 主 净化器 辅 净化器 时 辅 净化器 输入端 主 净化器 输出端 连接 使 主 净化器 控制器 驱动 辅 净化器 通风 模块 主 辅 净化器 进行 组合 操作 	分离
发明 公开 难 分解性 蛋白 质 分解剂 分解 剂 含有 具备 以下 特性 难 分解 蛋白质 具有 分解 活性 酶作为 有效 成分 活性 底物 专一性 水解 难 分解性 蛋白 质 肽键 分子量 等电点 最适 活性 最适 温度 ℃ 	分离
实用 新型 公开 种 槽式 防腐 屏蔽 电缆 桥架 包括 桥架盖 桥架 槽体 桥架 盖 桥架 槽体 内设 屏蔽 金属 丝网 桥架 盖 桥架 槽体 外设 防腐层 桥架 盖 桥架 槽体 金属 丝网 金属 钩锁 连接 在一起 组 槽体 外 连接 板用 螺栓 组合 在一起 实用 新型 导通 电阻 小于 Ω 屏蔽 防腐 性能 良好 种 理想 槽式 防腐 屏蔽 电缆 桥架 	分离
发明 提供 种 丹参 水溶性 成分 提取 去除 杂质 工艺 工艺 丹参 提取 液中 杂质 理化 特性 采用 水 提醇 沉淀法 配置 酸性 沉淀法 醇性 溶液 调值 法 操作 简便 经济 实用 提取 时间 短 去除 杂质 效果 好 发明 制得 丹参 水溶性 成分 提取 液可 用于 制备 丹参 注射液 复方 丹参 注射液 丹参 输液 复方 丹参 输液 丹参 制剂 	分离
实用 新型 目的 在于 提供 种 适应 起伏 变化 多端 规则 田地 除草 车 目的 在于 提供 种 培土 除草 车 底部 除草器 级 侧面 除草 器 联合 使用 保证 除草 效果 体积 小 驾驶 方便 	分离
发明 公开 种 烟草 气料 分离 方法 属 烟草 气力 输送 技术 先 利用 水平 沉降 物料 进行 前进 过程 中 动态 水平 沉降 使 大部分 物料 水平 沉降 管道 底部 前行 气流 水平 沉降 物料 送入 气料 分离 箱体 物料 分离 箱体 中 自重 气流 分离 后 分离 箱体 下面 出料 口 送出 气流 穿过 分离 箱体 上方 隔料 板 后 排放 优点 进行 气料 分离 时 造 碎 小 分离 精度 高 提高 烟草 物料 原料 利用率 	分离
发明 公开 种 用于 脱去 泥浆 中 气体 分析 泥浆 中 所含 气体 系统 第一 入口 供给 罐 泥浆 泥浆 第一 出口 排出 超声波 电声 换 器 包含 罐中 泥浆 中 产生 声能 场 泥浆 中 提取 气体 载气 罐 第二 入口 注入 提取 气体 物理 化学 分析 装置 连接至 为所 述载 气和 提取 气体 设计 罐 第二 出口 供应 给罐 泥浆 流率 调节 成 恒定 值 罐中 泥浆 体积 恒定 泥浆 石油 勘探 钻井 泥浆 构成 提取 气体 石油 启示 气体 可使 泥浆 供给 载气 注入 同步 能够 连续 分析 批量 分析 	分离
发明 公开 种 超声波 振动器 超声波 喷雾 粉碎机 超声波 振动器 包括 超声波 换 器 变幅 杆 变幅 杆 前端 设置 探头 特点 超声波 振动器 设置 贯穿 超声波 换 器 变幅 杆 探头 轴 通道 优点 使 轴向 通道 物料 超声波 振动器 内部 雾化 处理 物料 粒度 细 达到 纳米 	分离
种 液体 硫磺池 耐 高温 防腐蚀 结构 属于 硫磺 回收 技术 领域 特征 所述 液体 硫磺池 耐 高温 防腐蚀 结构 从外到里 依次 硫磺 池 壁板 保温 隔热 浇筑 层 氧化铝 瓷砖 层 构成 硫磺 池 壁板 保温 隔热 浇筑 层 设置 锚固件 发明 采用 材料 性能 混凝土 相近 膨胀 系数 相同 导热 系数 小 保温 耐 腐蚀 性能 优良 施工 十分 方便 保证 液硫 池 长 周期 安全 使用 大幅 降低 维护 维修 成本 腐蚀 侵蚀 液体 	分离
种 台式 气动 攻 丝机 属于 机械 加工 设备 技术 领域 涉及 种 台式 攻 丝机 实用 新型 目的 气动 装置 改变 现有 台式 攻 丝机 手工 操作 丝锥 进给 状况 该机 包括 主轴箱 主轴 箱内 装有 主动轮 动轮 主轴 机构 摩擦 轮 下 摩擦 轮 控制 摩擦 轮 下 摩擦 轮 主轴 机构 转动 运动 拨叉 主轴箱 装有 自动 控制 拨 叉上 下 动作 气动 装置 气动 装置 调压 阀 电磁 换向 阀 节流阀 气缸 组成 节流阀 气缸 之间 装有 输气管 气缸 活动 拨叉 之间 连杆 相 连接 电磁 换向 阀 装有 脚踏 开关 台式 气动 攻 丝机 改变 现有 台式 攻 丝机 手工 操作 控制 丝锥 进给 退出 操作 状况 减轻 人们 劳动 强度 保证 加工 精度 	分离
发明 提供 设置 破坏 层 逆反 射 片材 特征 在于 至少 包含 表面层 逆反射 元件 层 胶粘剂 层 逆反 射 片 材中 构成 逆 反射 片材 层 之间 设置 至少 层 破坏层 构成 破坏 层 树脂 为脂 环式 聚烯烃 树脂 或者脂 环式 丙烯酸 类 树脂 逆 反射 片 材贴 合于 基材 后 进行 剥离 时 破坏 层 破坏 层 粘合 层 界面 处 剥离 破坏 层 破坏 发生 剥离 	分离
实用 新型 公开 种 车载式 低压 水 射流 管网 管道 清洗 设备 动力 装置 循环 装置 测量 装置 控制 装置 排污 装置 安全 保护 装置 组成 具有 机动性 强 安全 可靠 操作 简单 除垢 率 高 清洗 堵塞 无 污染 腐蚀 实用 价值 高等 特点 设备 全部 安装 载重 卡车 能以 速度 进行 几百 公里 以外 异地 清洗 施工 利用 技术 设备 定期 管网 进行 清洗 延长 管网 使用 寿命 技术 问世 填补 物理 清洗 技术 设备 工作 压力 低 结构 复杂 管网 进行 清洗 空白 	分离
基体 银 银 合金 薄层 蚀刻 液而 均匀地 蚀刻 产生 蚀刻 残留 避免 过度 腐蚀 导致 侧面 腐蚀 蚀刻液 含有 重量 银 离子 蚀刻 液供入 罐 蚀刻 液供料 设备 中 使 基体 银 银 合金 薄层 接触 腐蚀 侵蚀 液体 	分离
实用 新型 公开 种 便携式 夹层 防弹 玻璃 切割机 行走 吸盘 行走 链板 行走 电机 减速 机 切割 电机 导轨 切割 刀片 手柄 链轮 机架 组成 行走 吸盘 装 行走 链板 行走 电机 装在 机架 减速 机 连接 减速 机 输出 轴 两 端 装 链轮 行走 链板 套在 链轮 切割 电机 装在 机架 切割 刀片 装 切割 电机 输出 轴上 导轨 装在 行走 吸盘 上方 真空 杠杆 装 行走 吸盘 实用 新型 具有 结构 简单 重量 轻 造 价低 效率 高 适应 场合 广 进行 任意 尺寸 任意 长度 切割 优点 特别 适合 现场 施工 使用 	分离
种 用于 挤压 工具 枢轴 式 夹钳 臂 包括 相对 侧面 夹钳 臂 枢轴孔 孔 纵向 相对 侧面 纵向 相对 端部 孔 横向 相对 侧面 位于 所述端部 之间 内缘 外缘 夹钳 臂 相对 侧面 对准 凹槽 构成 应力 集中 部分 内缘 枢轴 孔 延伸 内缘 形成 破坏点 疲劳 裂纹 始终 破坏点 产生 可使 夹钳 臂 破坏点 断裂 枢轴孔 	分离
种 低 成本 小型 高速 时钟 提取 电路 降低 相位 比较 器 速度 输入 非 回到 信号 进行 分频 得到 信号 压控 振荡器 输出 提取 时钟 信号 进行 分频 得到 信号 间作 相位 比较 在各 分频 信号 间 正确 比较 边沿 脉冲 选择 电路 情况 特别是 对分频 时钟 信号 上升 下降 作 相位 比较 情况 用于 相位 比较 按分频 信号 产生 信号 进行 选择 边沿 脉冲 作 相位 比较 相位 比较 低通 滤波器 输出 控制 压控 振荡器 	分离
实用 新型 涉及 种 空气 消毒 装置 特别是 涉及 种 室内外 空气 进行 杀菌 消毒 净化 装置 实用 新型 包括 壳体 设置 壳体 气泵 壳体 设置 进气口 排气口 出气 口 气泵 相 连接 壳体 设有 紫外线 灯 壳体 设有 若干 层叠 间隔层 间 隔层 喇叭 口状 间 隔层 扩开口 处 壳体 内壁 横截面 形状 相 适配 相邻 间隔 层 扩开口 处 开口 方向 相反 间 隔层 中央 设有 通孔 紫外线 灯 穿过 通孔 设置 壳体 内部 中央 采用 喇叭状 间隔层 间 隔层 带有 弧面 令 空气 通风 通道 爆发 瞬间 速度 加速 后 空气 间 隔层 弧面 产生 环绕 回旋 路径 增长 流动 距离 相应 延长 空气 进行 消毒 净化 时间 	分离
实用 新型 公开 种 改进型 超 高效 静电 除尘器 包括 除尘器 体 除尘器 体 设进 风口 风口 除尘器 体 下设 料斗 除尘器 体 内设 电场 装置 收尘板 除尘器 体内 电场 末端 设 导电 滤网 收集 装置 导电 滤网 收集 装置 包括 滤 网架 滤网架 设 导电 滤网 电尘 除器 电场 末端 设置 导电 滤网 收 尘极 有效 收集 未 收尘 板 吸附 粉尘 提高 电场 收尘 效率 出口 烟尘 排放 达标 前提 下 减少 电尘 除器 串联 电场 数量 大幅度 降低 体积 重量 投资 经济 效益 设 社会 效益 显著 	分离
实用 新型 工作 方式 现有 抽 油泵 相同 打破 以往 采用 钢 活塞 贯例 采用 种 软 质 活塞 材料 变形 性能 活塞 下行 程时 软 活塞环 向上 弯曲 活塞 行程 时 软 活塞环 向下 弯曲 方面 起到 密封 作用 油井 砂子 带出 泵筒 种 橡胶 环 结构 开口 向上 安装 既可以 有效 密封 带出 砂子 作用 避免 泵筒 磨损 为此 称为 防砂 抽 油泵 	分离
种 涉及 日常 生活 类 电器 产品 尤指 种 用于 家庭 旅馆 宿舍 使用 洗衣机 场所 洗衣机 排水 清 污 分流机 装置 分流器 分流 机 两 部分 组成 陪伺 程序 分流 器 包括 分流 器 外壳 水流 自动 开关 插座 普通 开关 旋转 开关 电磁铁 组合 触点 部件 分流 机 包括 自动 开关 插头 进 水管 水流 自动 开关 水泵 电磁铁 排水管 部件 组成 解决 市场 洗衣机 具有 上排 水 功能 清污 自动 分流 功能 技术 问题 实用 新型 优点 弥补 当前 市场 具有 上排 水 功能 洗衣机 存在 清污 自动 分流 功能 缺陷 方便 大多数 积蓄 漂洗 清水 节水 者们 产品 分流 机 结构 简单 制作 容易 成本 低 使用 方便 可靠 效果 好 	分离
发明 涉及 种 机电 致 发光 玻板 清洗 方法 装置 清洗 玻板 置于 真空 腔内 通入 高纯 氧气流 离子束 一定 角度 轰击 玻板 发明 清洗 装置 真 空腔 清洗 玻片 置于 真空 腔内 上部 支架 真 空腔 下部 侧 离子源 离子 源 样品 之间 设有 挡板 方法 装置 用于 清洗 离子束 一定 角度 入射 降低 清洗 玻片 表面 粗糙 度 表面 污染物 含量 玻片 产生 腐蚀 制备 成本 低 	分离
实用 新型 公开 种 多功能 拆装器 主杆 主杆 安装 挂盘 挂盘 安装 至少 根 拉杆 拉杆 端 挂盘 铰链 拉杆 端 设有 螺纹 主杆 下端 安装 滑杆 滑杆 安装 滑 套 滑 套上 设有 螺纹 维修 工作 中 情况 需要 种 拆装 头 抓手 任意 组合 使 维修 人员 高效 安全 拆装 轴承 油封 风叶 机械 部件 有效 避免 维修 过程 中用 常规 工具 飞机 汽车 火车 机械 设备 造成 损坏 具有 使用 方便 功能 多样 安全 高效 优点 	分离
发明 涉及 种 顽固 污渍 分解 剂 用途 特别 用于 毛巾 衣服 纺织品 染发 污渍 分解 发明 研制 种 顽固 污渍 分解剂 种 双 释 洗涤剂 含 活性 酶 速释 部分 迅速 祛除 毛巾 染料 油脂 蛋白质 含 聚氧乙烯 醚类 化合物 缓释 部分 祛除 毛巾 污渍 缓释 部分 中 含有 植物 皂苷 类 植物 挥发油 增加 祛污 能力 抗菌 能力 	分离
实用 新型 涉及 种 管道 切割机 特别 涉及 种 多功能 相贯管 切割机 解决 目前 国外 数控 相贯 切割机 无法 完成 弯管 半成品 部件 切割 加工 缺陷 多功能 相贯管 切割机 包括 导向 床身 主轴箱 控制 箱 形状 切割 调节 机构 割 嘴 升降 旋转 台钳 形状 切割 调节 机构 设置 导向 床身 尾部 形状 切割 调节 机构 摇杆 导轨 标尺 丝杆 配重 组成 摇杆 固定 连接 臂 两 侧 摇杆 平行 摇杆 可绕 转盘 中心 摇动 丝 杆 导轨 连接 固定 摇杆 摇杆 丝杆 垂直 丝 杆 十字 接头 偏心 板 连接 外侧 摇杆 设有 标尺 摇杆 可加 配重 主要 用于 造船 建筑 安装 化工 石油 机械 冶金 管式 框架 结构 管道 结构件 切割 加工 	分离
实用 新型 涉及 种 棉纱 布型 空气 滤清器 包括 框体 设于 框 体内 滤芯 特征 在于 所述滤芯 包括 丝网 层 下 丝网 层 设于 丝网 层 下 丝网 层 之间 棉纱 布层 实用 新型 目的 在于 提供 种 棉纱 布型 空气 滤清器 通气 过滤 性能 高 韧性 优良 易 变形 损坏 	分离
实用 新型 涉及 种 链板 刮板 复合型 排屑器 铰链 板 工作 面上 两 传动 链条 之间 设置 至少 刮屑板 铰链板 刮屑板 共用 传动 链条 铰链 板 工作区 排屑器 上行区 刮屑板 工作区 排屑器 下行 区 铰链 板 行时 排屑区 大量 切屑 随之 排出 排 屑器 外部 刮屑 板下 行时 残留 排屑器 内腔 残屑 刮到 铰链 板 上行 区内 排 屑器 上行 区 下行 区 组成 封闭 循环 提高 排屑 效率 无需 用户 清理 排屑器 内部 实现 排屑 自动化 实用 新型 能够 实施 普通 链板 排屑器 普通 刮板 排屑器 双 重 功能 使用 过程 无需 清理 排屑 内部 残屑 排屑器 适用于 用户 作业 面积 狭小 场合 自动化 程度 高 数控 机床 理想 辅助 设备 	分离
发明 公开 种 废旧 锂电池 中 活性 物质 酸性 浸出 液的 高效 净化 工艺 废旧 锂电池 正极 活性 材料 酸 浸液 净化 工序 主要 特点 采用 改进 水解 沉淀法 氧化 沉淀法 酸 浸液 中 杂质 离子 包括 以下 步骤 黄 钠 铁矾 法 除铁 氧化 沉淀法 除锰 碳酸 氢氨除铝 碳酸钠 除铜 发明 使用 方法 成本 低 操作 弹性 钴 回收率 高 综合 回收 铝 铜 锰等 价金 属 适用于 目前 广泛 使用 钴酸 锂 电池 材料 未来 使用 大量 掺杂 电池 材料 使用 方法 使 废旧 锂离子 电池 中 钴 总 回收率 约 杂质 含量 低于 	分离
实用 新型 公开 种 改进 支承 铆钉 离合器 包括 压盘 压盖 膜片 弹簧 支承 铆钉 特征 在于 所述 支承 铆钉 膜片 弹簧 压盖 铆接 一体 支承 铆钉 底部 台阶 表面 朝向 膜片 弹簧 中心 侧 斜坡 面 实用 新型 使 成本 低 结构 稳定 	分离
色 分解 合成 光学 系统 具有 照明 分解 成 色光 第和 第色 分解 光学 系统 具有 来自 上述 分解 光学 系统 上述 第色 引导 第图 象 显示 元件 来自 上述 第图 象 显示 元件 进行 检偏 偏振光 分离 面的 偏振光 分离 光学 系统 具有 来自 上述 分解 光学 系统 上述 第和 第色 进行 分解 上述 色光 第色 分别 引导 第和 第图 象 显示 元件 来自 上述 第和 上述 第图 象 显示 元件 进行 检偏 偏振光 分离 面的 偏振光 分离 光学 系统 来自 上述 第和 偏振光 分离 光学 系统 进行 合成 合成 光学 系统 偏振光 分离 面 偏振光 分离 面的 偏振光 分离 特性 有权 	分离
发明 公开 种 木浆 粉碎机 包括 壳体 齿辊 组合 刀 块 组合 刀 块 包括 下 栅栏 下 栅栏 开 设有 级 输出槽 级 输出槽 连通 木浆 粉碎机 粉碎 腔 粉碎机 粉碎 木浆 板 过程 中 级 输出槽 残留 粉碎 腔内 粉碎 韧 导出 降低 粉碎物 粉碎 腔内 滞留 成团 机率 导出 粉碎 腔内 漩涡 气流 脱流团 气流 改变 粉碎 腔内 气流 状态 减小 齿辊 气流 阻力 有效 降低 粉碎机 能耗 	分离
实用 新型 公开 种 自动 高速 切割机 包括 箱体 箱体 内设 主 电机 主 电机 连接 传动 装置 传动 装置 输出端 连接 砂轮 切割 片 箱体 设 试样 旋转 装置 试样 夹持 装置 试样 旋转 装置 下方 设 出样 漏斗 箱体 设有 支架 支架 铰接 摆臂 摆 臂 端 砂轮 切割 片 传动 轴 连接 摆 壁上 铰接 砂轮 切割 片 进给 驱动 装置 采用 设备 钢铁 柱状 试样 进行 切割 时 快速 高效 自动化 程度 高 切割 后 试样 表面 质量 好 设备 制造 使用 成本 远 低于 进口 设备 	分离
